{"schema":"mr.tournaments/1","version":"2026-09-27T040220Z","restriction":"standard_ban_list_26_05","tier_group":"store","tournaments":[{"tid":"a5240","name":"Fixture Tournament 602","date":"2026-07-11","restriction":"standard_ban_list_26_05","tier":"store","type":"store championship","online":false,"country":"United Kingdom","players":12,"swiss_format":null,"cut_size":4,"cobra_id":null,"abr_id":5240,"has_games":false,"decklist_coverage":0.75,"decklists":18}]}