{"schema":"mr.tournaments/1","version":"2026-09-27T040220Z","restriction":"standard_balance_update_26_08","tier_group":"store","tournaments":[{"tid":"c5012","name":"Fixture Tournament 108","date":"2026-09-12","restriction":"standard_balance_update_26_08","tier":"store","type":"store championship","online":false,"country":"Poland","players":8,"swiss_format":"double_sided","cut_size":0,"cobra_id":5012,"abr_id":5310,"has_games":true,"decklist_coverage":0.375,"decklists":6}]}