{"schema":"mr.tournaments/1","version":"2026-09-27T040220Z","restriction":"standard_ban_list_26_05","tier_group":"all","tournaments":[{"tid":"a5240","name":"Fixture Tournament 602","date":"2026-07-11","restriction":"standard_ban_list_26_05","tier":"store","type":"store championship","online":false,"country":"United Kingdom","players":12,"swiss_format":null,"cut_size":4,"cobra_id":null,"abr_id":5240,"has_games":false,"decklist_coverage":0.75,"decklists":18},{"tid":"a5250","name":"Fixture Tournament 600","date":"2026-06-20","restriction":"standard_ban_list_26_05","tier":"megacity","type":"megacity championship","online":false,"country":"Germany","players":20,"swiss_format":null,"cut_size":8,"cobra_id":null,"abr_id":5250,"has_games":false,"decklist_coverage":0.8,"decklists":32}]}