{"schema":"mr.tournaments/1","version":"2026-09-27T040221Z","restriction":"standard_balance_update_26_08","tier_group":"gnk","tournaments":[{"tid":"a5301","name":"Fixture Tournament 588","date":"2026-09-05","restriction":"standard_balance_update_26_08","tier":"gnk","type":"gnk / seasonal","online":false,"country":"Poland","players":10,"swiss_format":null,"cut_size":4,"cobra_id":null,"abr_id":5301,"has_games":false,"decklist_coverage":0.7,"decklists":14},{"tid":"c5015","name":"Fixture Tournament 104","date":"2026-08-22","restriction":"standard_balance_update_26_08","tier":"gnk","type":"gnk / seasonal","online":false,"country":null,"players":10,"swiss_format":"single_sided","cut_size":0,"cobra_id":5015,"abr_id":null,"has_games":true,"decklist_coverage":0.95,"decklists":19}]}