{"schema":"mr.tournaments/1","version":"2026-09-27T040221Z","restriction":"all","tier_group":"megacity","tournaments":[{"tid":"c4990","name":"Fixture Tournament 112","date":"2026-09-19","restriction":"standard_balance_update_26_08","tier":"megacity","type":"intercontinental championship","online":false,"country":"Poland","players":16,"swiss_format":"single_sided","cut_size":4,"cobra_id":4990,"abr_id":5284,"has_games":true,"decklist_coverage":1.0,"decklists":31},{"tid":"a5250","name":"Fixture Tournament 600","date":"2026-06-20","restriction":"standard_ban_list_26_05","tier":"megacity","type":"megacity championship","online":false,"country":"Germany","players":20,"swiss_format":null,"cut_size":8,"cobra_id":null,"abr_id":5250,"has_games":false,"decklist_coverage":0.8,"decklists":32}]}