{"schema":"mr.tournaments/1","version":"2026-09-27T040000Z","restriction":"standard_balance_update_26_08","tier_group":"megacity","tournaments":[{"tid":"c4990","name":"Fixture Tournament 112","date":"2026-09-19","restriction":"standard_balance_update_26_08","tier":"megacity","type":"intercontinental championship","online":false,"country":"Poland","players":16,"swiss_format":"single_sided","cut_size":4,"cobra_id":4990,"abr_id":5284,"has_games":true,"decklist_coverage":1.0,"decklists":31}]}