{"schema":"mr.tournaments/1","version":"2026-09-27T040221Z","restriction":"all","tier_group":"store","tournaments":[{"tid":"c5012","name":"Fixture Tournament 108","date":"2026-09-12","restriction":"standard_balance_update_26_08","tier":"store","type":"store championship","online":false,"country":"Poland","players":8,"swiss_format":"double_sided","cut_size":0,"cobra_id":5012,"abr_id":5310,"has_games":true,"decklist_coverage":0.375,"decklists":6},{"tid":"a5240","name":"Fixture Tournament 602","date":"2026-07-11","restriction":"standard_ban_list_26_05","tier":"store","type":"store championship","online":false,"country":"United Kingdom","players":12,"swiss_format":null,"cut_size":4,"cobra_id":null,"abr_id":5240,"has_games":false,"decklist_coverage":0.75,"decklists":18}]}